{
  "events": [
    {
      "attestation": "Updated requirements captured: closed wordmark plate above the fan intake, air-permeable central M mark, four supplied SVG colors, unchanged reversible clip interface, and explicit shell-clearance gate.",
      "authority": {
        "policy_id": "kobra3max-fan-cage-autonomous-to-print-candidate-v1",
        "policy_sha256": "94aed7126fec29437bcf70880486a4c0b68ba7b1921a10b0888ec10e0181378a",
        "type": "user-autonomy-policy"
      },
      "decided_by": {
        "id": "codex-root",
        "model": "gpt-5",
        "type": "agent"
      },
      "decision": "AUTO_APPROVED",
      "event_id": "4db6eb4b983518766209f55501e0acf64ae564b5cf58b7e0cedc7af1ff0877c9",
      "evidence": [],
      "previous_event_id": null,
      "reasons": [],
      "stage": "requirements-normalization"
    },
    {
      "attestation": "Selected an original top-label architecture: sand plate outside the intake with navy outlined wordmark, plus a 30 mm perforated four-color M grille and four non-crossing support links.",
      "authority": {
        "policy_id": "kobra3max-fan-cage-autonomous-to-print-candidate-v1",
        "policy_sha256": "94aed7126fec29437bcf70880486a4c0b68ba7b1921a10b0888ec10e0181378a",
        "type": "user-autonomy-policy"
      },
      "decided_by": {
        "id": "codex-root",
        "model": "gpt-5",
        "type": "agent"
      },
      "decision": "AUTO_APPROVED",
      "event_id": "a821dec8381970f8c0b0e129151c81c8261ea1562813c76e172052dcf07e4b21",
      "evidence": [],
      "previous_event_id": "4db6eb4b983518766209f55501e0acf64ae564b5cf58b7e0cedc7af1ff0877c9",
      "reasons": [],
      "stage": "concept"
    },
    {
      "attestation": "Design decomposed into navy structural body and wordmark, teal/aqua/sand first-layer partitions, air-permeable mark, upper plate, fit coupons, and unchanged clip datum.",
      "authority": {
        "policy_id": "kobra3max-fan-cage-autonomous-to-print-candidate-v1",
        "policy_sha256": "94aed7126fec29437bcf70880486a4c0b68ba7b1921a10b0888ec10e0181378a",
        "type": "user-autonomy-policy"
      },
      "decided_by": {
        "id": "codex-root",
        "model": "gpt-5",
        "type": "agent"
      },
      "decision": "AUTO_APPROVED",
      "event_id": "f6b72016b4bbd9dc5594bb87ff40469a260843e4022801a42c804f78484cef97",
      "evidence": [],
      "previous_event_id": "a821dec8381970f8c0b0e129151c81c8261ea1562813c76e172052dcf07e4b21",
      "reasons": [],
      "stage": "decomposition"
    },
    {
      "attestation": null,
      "authority": {
        "policy_id": "kobra3max-fan-cage-autonomous-to-print-candidate-v1",
        "policy_sha256": "94aed7126fec29437bcf70880486a4c0b68ba7b1921a10b0888ec10e0181378a",
        "type": "user-autonomy-policy"
      },
      "decided_by": {
        "id": "codex-root",
        "model": "gpt-5",
        "type": "agent"
      },
      "decision": "AUTO_APPROVED",
      "event_id": "97e598800016738cdfb64624dedcbd4af71628c91688d1c125f52715ac01aadf",
      "evidence": [
        {
          "hashed_report_inputs": true,
          "path": "/workspace/scratch/48853c409d66/kobra3max-fan-cage/reports/generator-mesh-report.json",
          "report_status": "PASS",
          "report_tool": "metrimade-voxel-generator",
          "sha256": "b41b75ed13884b511b2d2fc1fceaecd7980cc2b85c587e11a757850b96142f68",
          "size_bytes": 16138
        }
      ],
      "previous_event_id": "f6b72016b4bbd9dc5594bb87ff40469a260843e4022801a42c804f78484cef97",
      "reasons": [],
      "stage": "parametric-source"
    },
    {
      "attestation": null,
      "authority": {
        "policy_id": "kobra3max-fan-cage-autonomous-to-print-candidate-v1",
        "policy_sha256": "94aed7126fec29437bcf70880486a4c0b68ba7b1921a10b0888ec10e0181378a",
        "type": "user-autonomy-policy"
      },
      "decided_by": {
        "id": "codex-root",
        "model": "gpt-5",
        "type": "agent"
      },
      "decision": "AUTO_APPROVED",
      "event_id": "8632646594210a69831c3ef33db1e5a6b5220ee7a1335cb01ae587eb928f92af",
      "evidence": [
        {
          "hashed_report_inputs": true,
          "path": "/workspace/scratch/48853c409d66/kobra3max-fan-cage/reports/generator-mesh-report.json",
          "report_status": "PASS",
          "report_tool": "metrimade-voxel-generator",
          "sha256": "b41b75ed13884b511b2d2fc1fceaecd7980cc2b85c587e11a757850b96142f68",
          "size_bytes": 16138
        }
      ],
      "previous_event_id": "97e598800016738cdfb64624dedcbd4af71628c91688d1c125f52715ac01aadf",
      "reasons": [],
      "stage": "mesh-generation"
    }
  ],
  "ledger_type": "agent",
  "policy_id": "kobra3max-fan-cage-autonomous-to-print-candidate-v1",
  "policy_sha256": "94aed7126fec29437bcf70880486a4c0b68ba7b1921a10b0888ec10e0181378a",
  "project_id": "kobra3max-fan-cage",
  "schema_version": "1.0"
}
