{
  "events": [
    {
      "attestation": "Requirements normalized from SKU-196 and current demand evidence under explicit user-delegated autonomy.",
      "authority": {
        "policy_id": "MM-ORG-012-autonomous-to-print-candidate-v1",
        "policy_sha256": "9ffc2e64b41b9854e08782f1d25b4c5f6cf590c98a38c0d080948d0ec9a493c8",
        "type": "user-autonomy-policy"
      },
      "decided_by": {
        "id": "codex-root",
        "model": "gpt-5",
        "type": "agent"
      },
      "decision": "AUTO_APPROVED",
      "event_id": "6909b68f8b22372a8c845a3a83a5d3a02d2c485b0cdaea5e9ab78d651478b200",
      "evidence": [
        {
          "path": "/home/stefan/orca/workspaces/3d_models/3D-Design/products/organization-storage/mm-org-012-stationery-refill-inventory-tray/requirements-review.md",
          "sha256": "58ddf791e6c3edd509166533af22e85d3a009d97586e1225e498dfd19973acfc",
          "size_bytes": 583
        }
      ],
      "previous_event_id": null,
      "reasons": [],
      "stage": "requirements-normalization"
    },
    {
      "attestation": "Visible packet lanes and front scoop pockets selected against documented mixed-stash and retrieval failures.",
      "authority": {
        "policy_id": "MM-ORG-012-autonomous-to-print-candidate-v1",
        "policy_sha256": "9ffc2e64b41b9854e08782f1d25b4c5f6cf590c98a38c0d080948d0ec9a493c8",
        "type": "user-autonomy-policy"
      },
      "decided_by": {
        "id": "codex-root",
        "model": "gpt-5",
        "type": "agent"
      },
      "decision": "AUTO_APPROVED",
      "event_id": "d2cab1d40a887961889c0e7e981275c8926b5e2c7f3bf087bb4bcb53275f0655",
      "evidence": [
        {
          "path": "/home/stefan/orca/workspaces/3d_models/3D-Design/products/organization-storage/mm-org-012-stationery-refill-inventory-tray/concept-review.md",
          "sha256": "bc8a1798fc6ea465a8ce15984312f7e101916310d1948168182c307b4e22d2e3",
          "size_bytes": 522
        },
        {
          "path": "/home/stefan/orca/workspaces/3d_models/3D-Design/products/organization-storage/mm-org-012-stationery-refill-inventory-tray/assets/concept/MM-ORG-012-concept-v1.svg",
          "sha256": "74be2eb563914bdc06e2c26477cc165a97a6fe14e66660ab1317b4a2a89b79ac",
          "size_bytes": 1375
        }
      ],
      "previous_event_id": "6909b68f8b22372a8c845a3a83a5d3a02d2c485b0cdaea5e9ab78d651478b200",
      "reasons": [],
      "stage": "concept"
    },
    {
      "attestation": "Tray, production-derived retrieval coupon, parameter source and deferred physical evidence boundaries are explicit.",
      "authority": {
        "policy_id": "MM-ORG-012-autonomous-to-print-candidate-v1",
        "policy_sha256": "9ffc2e64b41b9854e08782f1d25b4c5f6cf590c98a38c0d080948d0ec9a493c8",
        "type": "user-autonomy-policy"
      },
      "decided_by": {
        "id": "codex-root",
        "model": "gpt-5",
        "type": "agent"
      },
      "decision": "AUTO_APPROVED",
      "event_id": "d356aafceb809454ff24fb25704aac385e2ab85b2ef410a8504b7a8a785274db",
      "evidence": [
        {
          "path": "/home/stefan/orca/workspaces/3d_models/3D-Design/products/organization-storage/mm-org-012-stationery-refill-inventory-tray/decomposition.md",
          "sha256": "81732dd1e62e5acc282210872c11521528329fbe1fc21212a3dc3f57b6b5b931",
          "size_bytes": 573
        }
      ],
      "previous_event_id": "d2cab1d40a887961889c0e7e981275c8926b5e2c7f3bf087bb4bcb53275f0655",
      "reasons": [],
      "stage": "decomposition"
    },
    {
      "attestation": null,
      "authority": {
        "policy_id": "MM-ORG-012-autonomous-to-print-candidate-v1",
        "policy_sha256": "9ffc2e64b41b9854e08782f1d25b4c5f6cf590c98a38c0d080948d0ec9a493c8",
        "type": "user-autonomy-policy"
      },
      "decided_by": {
        "id": "codex-root",
        "model": "gpt-5",
        "type": "agent"
      },
      "decision": "AUTO_APPROVED",
      "event_id": "ffb05b4dbdda5074ea170209ef598819a1e284b53f48efbe367aaa830cefca78",
      "evidence": [
        {
          "hashed_report_inputs": true,
          "path": "parametric-source-report.json",
          "report_status": "PASS",
          "report_tool": "MM-ORG-012-parametric-source",
          "sha256": "e4312769b198845e8b6d4a728d77f8062f4c8b7fa33d1d390a9c42420b512789",
          "size_bytes": 1407
        }
      ],
      "previous_event_id": "d356aafceb809454ff24fb25704aac385e2ab85b2ef410a8504b7a8a785274db",
      "reasons": [],
      "stage": "parametric-source"
    },
    {
      "attestation": null,
      "authority": {
        "policy_id": "MM-ORG-012-autonomous-to-print-candidate-v1",
        "policy_sha256": "9ffc2e64b41b9854e08782f1d25b4c5f6cf590c98a38c0d080948d0ec9a493c8",
        "type": "user-autonomy-policy"
      },
      "decided_by": {
        "id": "codex-root",
        "model": "gpt-5",
        "type": "agent"
      },
      "decision": "AUTO_APPROVED",
      "event_id": "d8b64cbcf90f1683171a521a79684174efa5aa03c887b3acb3380c0a7e420cae",
      "evidence": [
        {
          "hashed_report_inputs": true,
          "path": "mesh-generation-report.json",
          "report_status": "PASS",
          "report_tool": "MM-ORG-012-mesh-generation",
          "sha256": "840ed24e2ba14aec6d39682901e4dfb8ff48d1f88a239e5f33986b72b90d983d",
          "size_bytes": 4864
        },
        {
          "hashed_report_inputs": true,
          "path": "fdm-mesh-tray.json",
          "report_status": "PASS",
          "report_tool": "audit-mesh",
          "sha256": "6cffc41e695621cab8574fdedba1554800dd9ea3d57fa3df536a5d30adccb091",
          "size_bytes": 4526
        },
        {
          "hashed_report_inputs": true,
          "path": "fdm-mesh-coupon.json",
          "report_status": "PASS",
          "report_tool": "audit-mesh",
          "sha256": "296f41e4e8316672d8b9aef805717753125022ddd793bf08214af78464173732",
          "size_bytes": 4550
        },
        {
          "hashed_report_inputs": true,
          "path": "fdm-3mf.json",
          "report_status": "PASS",
          "report_tool": "validate-3mf",
          "sha256": "9625c855434e97480cf117c12b209083f775e6c4977dc53e2a6438cd1fbb2445",
          "size_bytes": 2540
        }
      ],
      "previous_event_id": "ffb05b4dbdda5074ea170209ef598819a1e284b53f48efbe367aaa830cefca78",
      "reasons": [],
      "stage": "mesh-generation"
    },
    {
      "attestation": null,
      "authority": {
        "policy_id": "MM-ORG-012-autonomous-to-print-candidate-v1",
        "policy_sha256": "9ffc2e64b41b9854e08782f1d25b4c5f6cf590c98a38c0d080948d0ec9a493c8",
        "type": "user-autonomy-policy"
      },
      "decided_by": {
        "id": "codex-root",
        "model": "gpt-5",
        "type": "agent"
      },
      "decision": "AUTO_APPROVED",
      "event_id": "ec5c75d7c4ec9ea46ab7eae54314264400ba61fa150e2cecf578b8ba2ba0701c",
      "evidence": [
        {
          "hashed_report_inputs": true,
          "path": "interface-report.json",
          "report_status": "PASS",
          "report_tool": "MM-ORG-012-interface-validation",
          "sha256": "0b3b3a5ab61c35882c178c1958793db8c112cae4609a9c9eebdea0291e9c2099",
          "size_bytes": 4424
        }
      ],
      "previous_event_id": "d8b64cbcf90f1683171a521a79684174efa5aa03c887b3acb3380c0a7e420cae",
      "reasons": [],
      "stage": "interface-validation"
    },
    {
      "attestation": null,
      "authority": {
        "policy_id": "MM-ORG-012-autonomous-to-print-candidate-v1",
        "policy_sha256": "9ffc2e64b41b9854e08782f1d25b4c5f6cf590c98a38c0d080948d0ec9a493c8",
        "type": "user-autonomy-policy"
      },
      "decided_by": {
        "id": "codex-root",
        "model": "gpt-5",
        "type": "agent"
      },
      "decision": "AUTO_APPROVED",
      "event_id": "e83cf2626d6a9ee5556f696731c2ce74a71d91730142eb78034e9d89d368b486",
      "evidence": [
        {
          "hashed_report_inputs": true,
          "path": "slicer-anycubic-next.json",
          "report_status": "PASS",
          "report_tool": "slice-anycubic-next",
          "sha256": "73e2ef682e5579d64f814d882424531bbb562bd2f620e7493c31b450521987b7",
          "size_bytes": 10498
        }
      ],
      "previous_event_id": "ec5c75d7c4ec9ea46ab7eae54314264400ba61fa150e2cecf578b8ba2ba0701c",
      "reasons": [],
      "stage": "slicer-preflight"
    },
    {
      "attestation": null,
      "authority": {
        "policy_id": "MM-ORG-012-autonomous-to-print-candidate-v1",
        "policy_sha256": "9ffc2e64b41b9854e08782f1d25b4c5f6cf590c98a38c0d080948d0ec9a493c8",
        "type": "user-autonomy-policy"
      },
      "decided_by": {
        "id": "codex-root",
        "model": "gpt-5",
        "type": "agent"
      },
      "decision": "AUTO_APPROVED",
      "event_id": "00fda3dd5ce0ab22df5bb628d6a7096df82cfa27131301d612caa1818d5f318e",
      "evidence": [
        {
          "hashed_report_inputs": true,
          "path": "print-candidate-report.json",
          "report_status": "PASS",
          "report_tool": "MM-ORG-012-finalize-digital-candidate",
          "sha256": "d742c9fe1f2269132e5e5d18342105fa17920fbd22f4791f633b242732c25273",
          "size_bytes": 4773
        }
      ],
      "previous_event_id": "e83cf2626d6a9ee5556f696731c2ce74a71d91730142eb78034e9d89d368b486",
      "reasons": [],
      "stage": "print-candidate"
    }
  ],
  "ledger_type": "agent",
  "policy_id": "MM-ORG-012-autonomous-to-print-candidate-v1",
  "policy_sha256": "9ffc2e64b41b9854e08782f1d25b4c5f6cf590c98a38c0d080948d0ec9a493c8",
  "project_id": "MM-ORG-012",
  "schema_version": "1.0"
}
