{
  "events": [
    {
      "attestation": "Revision 1.2.0 preserves the approved external concept and three-button all-required function while replacing the former unimplemented ratchet with independently verifiable local latches",
      "authority": {
        "policy_id": "MM-PUZ-002-autonomous-to-print-candidate-v1",
        "policy_sha256": "46ad3bd739bea594e12f31d2d62d707f78c0da21d2bcf246b0bc4591ea8d50c7",
        "type": "user-autonomy-policy"
      },
      "decided_by": {
        "id": "codex-root",
        "model": "gpt-5",
        "type": "agent"
      },
      "decision": "AUTO_APPROVED",
      "event_id": "2ffae799ea950fbc37c7fbf10a2d29be442f8bbf19a83413f44415e9b19a3084",
      "evidence": [],
      "previous_event_id": null,
      "reasons": [],
      "stage": "requirements-normalization"
    },
    {
      "attestation": "The concept remains applicable because envelope, seam intent, question-mark camouflage and three-button interaction are retained; the architecture change is internal",
      "authority": {
        "policy_id": "MM-PUZ-002-autonomous-to-print-candidate-v1",
        "policy_sha256": "46ad3bd739bea594e12f31d2d62d707f78c0da21d2bcf246b0bc4591ea8d50c7",
        "type": "user-autonomy-policy"
      },
      "decided_by": {
        "id": "codex-root",
        "model": "gpt-5",
        "type": "agent"
      },
      "decision": "AUTO_APPROVED",
      "event_id": "064a78a83a770120a366fe82227c2577b9b77dbe19695a3212cf1c155695cfb9",
      "evidence": [],
      "previous_event_id": "2ffae799ea950fbc37c7fbf10a2d29be442f8bbf19a83413f44415e9b19a3084",
      "reasons": [],
      "stage": "concept"
    },
    {
      "attestation": "The assembly is decomposed into one body, one lid, three identical sliders and three identical replaceable leaves with explicit interfaces and physical evidence boundaries",
      "authority": {
        "policy_id": "MM-PUZ-002-autonomous-to-print-candidate-v1",
        "policy_sha256": "46ad3bd739bea594e12f31d2d62d707f78c0da21d2bcf246b0bc4591ea8d50c7",
        "type": "user-autonomy-policy"
      },
      "decided_by": {
        "id": "codex-root",
        "model": "gpt-5",
        "type": "agent"
      },
      "decision": "AUTO_APPROVED",
      "event_id": "fd4773251796ff5d21b912e577b7230a324929bd956d379808fbc4905211156c",
      "evidence": [],
      "previous_event_id": "064a78a83a770120a366fe82227c2577b9b77dbe19695a3212cf1c155695cfb9",
      "reasons": [],
      "stage": "decomposition"
    },
    {
      "attestation": null,
      "authority": {
        "policy_id": "MM-PUZ-002-autonomous-to-print-candidate-v1",
        "policy_sha256": "46ad3bd739bea594e12f31d2d62d707f78c0da21d2bcf246b0bc4591ea8d50c7",
        "type": "user-autonomy-policy"
      },
      "decided_by": {
        "id": "codex-root",
        "model": "gpt-5",
        "type": "agent"
      },
      "decision": "AUTO_APPROVED",
      "event_id": "324cb7e41f686670e066bbb3dc6e022c109354b6aa4c0f5424370e18d52235bc",
      "evidence": [
        {
          "hashed_report_inputs": true,
          "path": "source-report.json",
          "report_status": "PASS",
          "report_tool": "puzzle-box-source-check",
          "sha256": "340d28f875cd5e63500f1c339e91680806605032879f92b3511ae509377b4029",
          "size_bytes": 4072
        }
      ],
      "previous_event_id": "fd4773251796ff5d21b912e577b7230a324929bd956d379808fbc4905211156c",
      "reasons": [],
      "stage": "parametric-source"
    },
    {
      "attestation": null,
      "authority": {
        "policy_id": "MM-PUZ-002-autonomous-to-print-candidate-v1",
        "policy_sha256": "46ad3bd739bea594e12f31d2d62d707f78c0da21d2bcf246b0bc4591ea8d50c7",
        "type": "user-autonomy-policy"
      },
      "decided_by": {
        "id": "codex-root",
        "model": "gpt-5",
        "type": "agent"
      },
      "decision": "AUTO_APPROVED",
      "event_id": "4def9bdd55a652c0b5220324a35428ae23f1728aa202d411f9dd2fa21dbb2fa9",
      "evidence": [
        {
          "hashed_report_inputs": true,
          "path": "mesh-body.json",
          "report_status": "PASS",
          "report_tool": "audit-mesh",
          "sha256": "42665fd9cdd97f15af1d62a55483610bf15c88f3d8fde73eb3bcb2704c90ecc0",
          "size_bytes": 4461
        },
        {
          "hashed_report_inputs": true,
          "path": "mesh-lid.json",
          "report_status": "PASS",
          "report_tool": "audit-mesh",
          "sha256": "d13782f67124c37d5ed5a48c8ff95adfee4630e9f67697f813647197850b3ea4",
          "size_bytes": 4496
        },
        {
          "hashed_report_inputs": true,
          "path": "mesh-slider.json",
          "report_status": "PASS",
          "report_tool": "audit-mesh",
          "sha256": "414633c1e6aa1e87314a421ba71a1e52370f5fc68463eb5c5a487a21d8cf9547",
          "size_bytes": 4547
        },
        {
          "hashed_report_inputs": true,
          "path": "mesh-return-leaf.json",
          "report_status": "PASS",
          "report_tool": "audit-mesh",
          "sha256": "e1c09eaa5de843f30e4d9d6d543d2cc4d33c0dc11db74181c72533b2feb17f05",
          "size_bytes": 4435
        },
        {
          "hashed_report_inputs": true,
          "path": "3mf-print-set.json",
          "report_status": "PASS",
          "report_tool": "validate-3mf",
          "sha256": "0499f66563d3bd378f3557eeab0f19f7b9a920fdbf5348f512cf0a0fcf7bf610",
          "size_bytes": 3475
        }
      ],
      "previous_event_id": "324cb7e41f686670e066bbb3dc6e022c109354b6aa4c0f5424370e18d52235bc",
      "reasons": [],
      "stage": "mesh-generation"
    },
    {
      "attestation": null,
      "authority": {
        "policy_id": "MM-PUZ-002-autonomous-to-print-candidate-v1",
        "policy_sha256": "46ad3bd739bea594e12f31d2d62d707f78c0da21d2bcf246b0bc4591ea8d50c7",
        "type": "user-autonomy-policy"
      },
      "decided_by": {
        "id": "codex-root",
        "model": "gpt-5",
        "type": "agent"
      },
      "decision": "AUTO_APPROVED",
      "event_id": "2e720ed558425b688b39f7eace575b0d4c40430eeea91f07270bbeaec7de658a",
      "evidence": [
        {
          "hashed_report_inputs": true,
          "path": "interface-report.json",
          "report_status": "PASS",
          "report_tool": "puzzle-box-interface-check",
          "sha256": "1cb0f5b90ee8c4a209017635915adf06412b85fec8cd783a6afacd4d604f399e",
          "size_bytes": 2822
        },
        {
          "hashed_report_inputs": true,
          "path": "flexure-screen.json",
          "report_status": "PASS",
          "report_tool": "puzzle-box-flexure-screen",
          "sha256": "eb6e0f47c62f2ffd5ef797957a177da37955c8b7e0b73232d1b2d01984a2edb1",
          "size_bytes": 1719
        },
        {
          "hashed_report_inputs": true,
          "path": "texture-report.json",
          "report_status": "PASS",
          "report_tool": "puzzle-box-texture-check",
          "sha256": "822638d16b0eb6046d95799012b8678e01f298fcba8aba642218c28a2945e18b",
          "size_bytes": 2178
        },
        {
          "hashed_report_inputs": true,
          "path": "watermark-digital.json",
          "report_status": "PASS",
          "report_tool": "puzzle-box-watermark-check",
          "sha256": "1728e0310b8139bdb653feb677e32deee2e7548eeb498f433ce783fb2153016c",
          "size_bytes": 1978
        }
      ],
      "previous_event_id": "4def9bdd55a652c0b5220324a35428ae23f1728aa202d411f9dd2fa21dbb2fa9",
      "reasons": [],
      "stage": "interface-validation"
    },
    {
      "attestation": null,
      "authority": {
        "policy_id": "MM-PUZ-002-autonomous-to-print-candidate-v1",
        "policy_sha256": "46ad3bd739bea594e12f31d2d62d707f78c0da21d2bcf246b0bc4591ea8d50c7",
        "type": "user-autonomy-policy"
      },
      "decided_by": {
        "id": "codex-root",
        "model": "gpt-5",
        "type": "agent"
      },
      "decision": "BLOCKED",
      "event_id": "4a71e4d4da4f2fe49715fea49e94267283a1ea321062ddba430109468d343dcb",
      "evidence": [
        {
          "hashed_report_inputs": true,
          "path": "slicer-preflight.json",
          "report_status": "NOT_RUN",
          "report_tool": "puzzle-box-slicer-preflight",
          "sha256": "7ad53a17a53a8535cdae23d52c74b5b1008d97906a52d6a8d749e0ea8036ff5d",
          "size_bytes": 1032
        }
      ],
      "previous_event_id": "2e720ed558425b688b39f7eace575b0d4c40430eeea91f07270bbeaec7de658a",
      "reasons": [
        "evidence report is not PASS: /home/stefan/Projekte/3d_models/products/toys-games/mm-puz-002-mystery-puzzle-box/validation/slicer-preflight.json",
        "evidence report contains a non-PASS required check: /home/stefan/Projekte/3d_models/products/toys-games/mm-puz-002-mystery-puzzle-box/validation/slicer-preflight.json"
      ],
      "stage": "slicer-preflight"
    }
  ],
  "ledger_type": "agent",
  "policy_id": "MM-PUZ-002-autonomous-to-print-candidate-v1",
  "policy_sha256": "46ad3bd739bea594e12f31d2d62d707f78c0da21d2bcf246b0bc4591ea8d50c7",
  "project_id": "MM-PUZ-002",
  "schema_version": "1.0"
}
